{
  "$schema": "https://json-schema.org/draft/2020-12/schema",
  "$id": "https://chalcolith.github.io/enochian/schemas/sampling-protocol-1.json",
  "title": "Enochian balanced sampling and sequence-null protocol",
  "type": "object",
  "additionalProperties": false,
  "required": ["$schema", "schema_version", "sampling_id", "generator_version", "seed", "repetitions", "queries_path", "mapping", "analyses"],
  "properties": {
    "$schema": { "type": "string", "format": "uri-reference" },
    "schema_version": { "const": "1.0.0" },
    "sampling_id": { "$ref": "#/$defs/id" },
    "generator_version": { "const": "balanced-nulls-v1" },
    "seed": { "type": "integer", "minimum": 0 },
    "repetitions": { "type": "integer", "minimum": 1 },
    "null_repetitions": { "type": "integer", "minimum": 1 },
    "queries_path": { "$ref": "#/$defs/path" },
    "mapping": {
      "type": "object",
      "minProperties": 1,
      "additionalProperties": {
        "type": "array",
        "minItems": 1,
        "items": { "type": "number" }
      }
    },
    "analyses": {
      "type": "array",
      "minItems": 1,
      "items": {
        "type": "object",
        "additionalProperties": false,
        "required": ["analysis_id", "analysis_set", "included_entry_kinds", "smaller_sample_sizes", "frequency_bands", "sources", "outputs"],
        "properties": {
          "analysis_id": { "$ref": "#/$defs/id" },
          "analysis_set": { "enum": ["primary", "full", "inflected"] },
          "included_entry_kinds": {
            "type": "array",
            "minItems": 1,
            "uniqueItems": true,
            "items": { "enum": ["lemma", "inflected_form", "proper_name", "abbreviation"] }
          },
          "smaller_sample_sizes": {
            "type": "array",
            "uniqueItems": true,
            "items": { "type": "integer", "minimum": 1 }
          },
          "frequency_bands": {
            "type": "array",
            "items": {
              "type": "object",
              "additionalProperties": false,
              "required": ["id", "minimum", "maximum"],
              "properties": {
                "id": { "$ref": "#/$defs/id" },
                "minimum": { "type": ["number", "null"], "minimum": 0 },
                "maximum": { "type": ["number", "null"], "exclusiveMinimum": 0 }
              }
            }
          },
          "sources": {
            "type": "array",
            "minItems": 2,
            "items": {
              "type": "object",
              "additionalProperties": false,
              "required": ["source_id", "language", "lexicon_path"],
              "properties": {
                "source_id": { "$ref": "#/$defs/id" },
                "language": { "type": "string", "pattern": "^[a-z]{2,3}$" },
                "lexicon_path": { "$ref": "#/$defs/path" }
              }
            }
          },
          "outputs": {
            "type": "object",
            "additionalProperties": false,
            "required": ["memberships", "nulls", "report"],
            "properties": {
              "memberships": { "$ref": "#/$defs/path" },
              "nulls": { "$ref": "#/$defs/path" },
              "report": { "$ref": "#/$defs/path" }
            }
          }
        }
      }
    }
  },
  "$defs": {
    "id": { "type": "string", "pattern": "^[a-z0-9][a-z0-9._-]*$" },
    "path": { "type": "string", "minLength": 1, "pattern": "^(?![A-Za-z]:|/|\\\\)" }
  }
}
