{
  "$schema": "../schemas/sampling-protocol.schema.json",
  "schema_version": "1.0.0",
  "sampling_id": "synthetic-smoke",
  "generator_version": "balanced-nulls-v1",
  "seed": 101,
  "repetitions": 2,
  "null_repetitions": 16,
  "queries_path": "queries.jsonl",
  "mapping": {
    "t": [0,1,0,0,0,1,-1,-1,1,-1,-1,-1,0,0,0,-1,-1,0,-1,-1,0,0,0,0,-1,-1,-1,-1,0,-1],
    "d": [0,1,0,0,0,1,-1,-1,1,-1,-1,-1,0,0,0,-1,-1,0,-1,-1,0,0,0,0,-1,-1,-1,-1,0,1],
    "s": [0,1,0,0,0,1,-1,1,1,-1,-1,-1,0,0,0,-1,-1,0,-1,-1,0,0,0,0,-1,-1,1,-1,0,-1],
    "z": [0,1,0,0,0,1,-1,1,1,-1,-1,-1,0,0,0,-1,-1,0,-1,-1,0,0,0,0,-1,-1,1,-1,0,1]
  },
  "analyses": [
    {
      "analysis_id": "primary",
      "analysis_set": "primary",
      "included_entry_kinds": ["lemma"],
      "smaller_sample_sizes": [],
      "frequency_bands": [],
      "sources": [
        { "source_id": "synthetic-target", "language": "tar", "lexicon_path": "target.jsonl" },
        { "source_id": "synthetic-control", "language": "ctl", "lexicon_path": "control.jsonl" }
      ],
      "outputs": {
        "memberships": "outputs/memberships.jsonl",
        "nulls": "outputs/nulls.jsonl",
        "report": "outputs/sampling-report.json"
      }
    }
  ]
}
